<?xml version="1.0" encoding="UTF-8"?>
<testplan xmlns="http://www.archivator.de/testplan" xmlns:xsi="http://www.w3.org/2001/XMLSchema-instance"
	xsi:schemaLocation="http://www.archivator.de/testplan testplan.xsd">
	<testfall titel="test">
		<vorraussetzungen>
			<vorraussetzung></vorraussetzung>
		</vorraussetzungen>
		<durchführung>
			<schritt>
				<ergebnisse>
					<ergebnis />
				</ergebnisse>
			</schritt>
		</durchführung>
	</testfall>
</testplan>